Date,Title,Description,Source,Domain,Keyword Matches,URL
2025-08-23 16:00,Colorado gas prices rose from last week: See how much here,,Yahoo Entertainment,consent.yahoo.com,1,https://consent.yahoo.com/v2/collectConsent?sessionId=1_cc-session_08f3cbe9-026c-4edd-aefe-d0da9181c0bc
2025-08-23 13:00,Natural Gas Price Trends,"But ignoring COVID and Ukraine, current gas prices are not excessive by historical standards, and therefore cannot explain why electricity prices are so high now.",Wattsupwiththat.com,wattsupwiththat.com,1,https://wattsupwiththat.com/2025/08/23/natural-gas-price-trends/
2025-08-23 09:03,Lower Atlantic region gas prices held steady to last week: See how much here,Here's a look at how weekly regional gas prices changed in Lower Atlantic last week compared with the week prior.,The Fayetteville Observer,www.fayobserver.com,1,https://www.fayobserver.com/story/news/local/2025/08/23/weekly-gas-prices/85746922007/
2025-08-23 08:07,Nigeria LNG inks long-term contracts to secure gas supply,,Biztoc.com,biztoc.com,2,https://biztoc.com/x/387d864847efc52b
2025-08-23 07:40,Ukrainian refuses German extradition in Nord Stream sabotage case,"A Ukrainian man arrested in Italy this week over the 2022 sabotage of the Nord Stream underwater gas pipelines from Russia to Europe on Friday refused to be extradited to Germany, reports said.",The Local Germany,www.thelocal.de,1,https://www.thelocal.de/20250823/ukrainian-refuses-german-extradition-in-nord-stream-sabotage-case
