Date,Title,Description,URL,Author
2024-03-04,Tellurian to take FID on Driftwood LNG export project in 2024,US LNG developer Tellurian expects to make a final investment decision (FID) on its proposed 27.6 mtpa Driftwood LNG export project in Louisiana and issue a full notice to proceed with the construction of the first phase in this year.,https://terminal.kpler.com/insight/news/tellurian-to-take-fid-on-driftwood-lng-export-project-in-2024,JS
2024-03-04,Gas producer EQT to cut natural gas production in March amid low prices,"US natural gas producer EQT Corporation made a “strategic decision” to curtail natural gas production due to low natural gas prices, resulting from warm winter and high storage levels.",https://terminal.kpler.com/insight/news/gas-producer-eqt-to-cut-natural-gas-production-in-march-amid-low-prices,JS
2024-03-04,Thailand’s PTT seeks two March-April LNG cargoes,Thailand’s state-owned PTT has issued a tender to buy two LNG cargoes for delivery in March and April to its Map Ta Phut LNG receiving terminal in the country’s southern Rayong province. The tender closes on Mar. 6.,https://terminal.kpler.com/insight/news/thailand-s-ptt-seeks-two-march-april-lng-cargoes,CK
2024-03-04,"Three Philippines power firms to acquire AG&P’s Philippines LNG terminal, invest in power plants",Three private power companies in the Philippines will jointly invest in power plants and acquire the existing 3 mtpa Philippines LNG import terminal in the country’s Luzon region.,https://terminal.kpler.com/insight/news/three-philippines-power-firms-to-acquire-ag-and-p-s-philippines-lng-terminal-invest-in-power-plants,JS
2024-03-04,Argentina’s Enarsa seeks 10 LNG cargoes for delivery in April-July to Escobar,"Argentina’s state-owned Energia Argentina, or Enarsa, has issued a tender to buy 10 LNG cargoes for delivery between April and July to the country’s 6.1 mtpa Escobar LNG receiving terminal. The tender closes on Mar. 12 and offers are expected to remain valid until a day later.",https://terminal.kpler.com/insight/news/argentina-s-enarsa-seeks-10-lng-cargoes-for-delivery-in-april-july-to-escobar,CK
2024-03-04,Eni’s Congo FLNG ships its first LNG cargo; delivery at Piombino expected by end of the week,"The Eni-operated 0.6 mtpa Congo floating LNG facility in the Republic of Congo’s Point Noire has shipped its maiden cargo, almost a week after the 154,800 m3 Gaslog Savannah LNG tanker arrived at the terminal for loading.",https://terminal.kpler.com/insight/news/eni-s-congo-flng-ships-its-first-lng-cargo-delivery-at-piombino-expected-by-end-of-the-week,CK
