Date,Title,Description,URL,Author
2025-04-15,"Europe to anchor summer LNG demand rise, but market risks loom — Kpler Insight","Global LNG supply is set to rise by nearly 10 mt this summer, with Europe leading demand growth as it refills gas stocks depleted by a cold winter, according to Kpler Insight’s Summer 2025 LNG Outlook released during a webinar today.",https://terminal.kpler.com/insight/news/europe-to-anchor-summer-lng-demand-rise-but-market-risks-loom-kpler-insight,CK
2025-04-15,Venture Global starts commercial operations at Calcasieu Pass LNG plant,US LNG exporter Venture Global has announced the start of commercial operations at its 10 mtpa Calcasieu Pass and the commencement of long-term contractual supply to its clients.,https://terminal.kpler.com/insight/news/venture-global-starts-commercial-operations-at-calcasieu-pass-lng-plant,JS
2025-04-15,TotalEnergies to supply 0.4 mtpa of LNG to Dominican Republic’s Enadom,"TotalEnergies has signed a heads of agreement with Energia Natural Dominicana (Enadom) to deliver 0.4 mtpa of LNG for 15 years, commencing in mid-2027.",https://terminal.kpler.com/insight/news/total-energies-to-supply-0-4-mtpa-of-lng-to-dominican-republic-s-enadom,JS
2025-04-15,Energy Transfer asks FERC to extend construction deadline for Lake Charles LNG,US-based midstream firm Energy Transfer has requested the Federal Energy Regulatory Commission (FERC) to extend the construction deadline of the 16.5 mtpa Lake Charles LNG export plant in Louisiana by three years.,https://terminal.kpler.com/insight/news/energy-transfer-asks-ferc-to-extend-construction-deadline-for-lake-charles-lng,JS
2025-04-15,Heat exchanger issues on Ichthys FPSO curb LNG output; two May cargoes seen lost,"A fault in a heat exchanger on the Ichthys offshore floating production, storage and offloading unit has reduced LNG production at Australia’s 8.9 mtpa Ichthys facility, with at least two cargoes for May delivery likely to be lost, according to offtakers at the plant.",https://terminal.kpler.com/insight/news/heat-exchanger-issues-on-ichthys-fpso-curb-lng-output-two-may-cargoes-seen-lost,CK
2025-04-15,Inpex confirms temporary production dip at Ichthys LNG,"The 8.9 mtpa Ichthys LNG plant in Australia’s Northern Territory, operated by Japanese upstream firm Inpex, is facing a drop in production after reaching a record high in January.",https://terminal.kpler.com/insight/news/inpex-confirms-temporary-production-dip-at-ichthys-lng,CK
