Date,Title,Description,URL,Author
2025-04-17,Cheniere asks FERC to start site preparation for Corpus Christi Midscale Trains 8 & 9,"Cheniere has filed a request with the Federal Energy Regulatory Committee (FERC) to commence site preparations for its next expansion of the Corpus Christi Liquefaction (CCL) plant, the Train 8 and 9 project, next month.",https://terminal.kpler.com/insight/news/cheniere-asks-ferc-to-start-site-preparation-for-corpus-christi-midscale-trains-8-and-9,JS
2025-04-17,Sahara Group to offtake 0.6 mtpa from Mexico’s Amigo LNG for 20 years,Energy and infrastructure firm Sahara Group has signed a 20-year sales and purchase agreement with Amigo LNG to offtake 0.6 mtpa of LNG.,https://terminal.kpler.com/insight/news/sahara-group-to-offtake-0-6-mtpa-from-mexico-s-amigo-lng-for-20-years,JS
2025-04-17,Sanctions pressure clouds Russia’s ambitious new energy strategy: Kpler Insight,"Russia’s ambitious targets for expanding its natural gas and LNG production through 2050 face mounting challenges due to international sanctions, according to Kpler Insight.",https://terminal.kpler.com/insight/news/sanctions-pressure-clouds-russia-s-ambitious-new-energy-strategy-kpler-insight,JS
2025-04-17,Bintulu LNG exports dip amid possible plant issues; at least one April cargo deferred,"LNG exports from the Petronas-operated 29.3 mtpa Bintulu LNG export terminal in Malaysia have declined week-on-week since late March, with industry participants citing equipment trouble at one or more liquefaction trains as a possible reason for the slowdown.",https://terminal.kpler.com/insight/news/bintulu-lng-exports-dip-amid-possible-plant-issues-at-least-one-april-cargo-deferred,CK
2025-04-17,BP confirms completion of first LNG cargo loading from Greater Tortue Ahmeyim FLNG,"BP has confirmed the completion of the first LNG cargo loading from its 2.5 mtpa Greater Tortue Ahmeyim floating LNG project offshore Mauritania and Senegal, with the cargo’s shipment set to mark the start of LNG exports from both countries and BP’s third major upstream project to come online this year.",https://terminal.kpler.com/insight/news/bp-confirms-completion-of-first-lng-cargo-loading-from-greater-tortue-ahmeyim-flng,CK
2025-04-17,Gastrade eyes earliest restart in late May for Alexandroupolis LNG terminal after months-long outage,"Greece’s Gastrade expects to begin gradually ramping up operations at its 4 mtpa Alexandroupolis floating storage and regasification unit (FSRU)-based LNG import terminal from late May, following a months-long shutdown due to a technical issue.",https://terminal.kpler.com/insight/news/gastrade-eyes-earliest-restart-in-late-may-for-alexandroupolis-lng-terminal-after-months-long-outage,CK
2025-04-17,"Deutsche ReGas terminal in Mukran booked out for 2025,  two-FSRU setup by 2027 eyed","All regasification capacity for 2025 at Deutsche ReGas’s Deutsche Ostsee LNG terminal in Mukran on Germany’s Rügen Island has been fully booked, driven by strong demand to refill gas storage sites and sustained high consumption levels.",https://terminal.kpler.com/insight/news/deutsche-re-gas-terminal-in-mukran-booked-out-for-2025-two-fsru-setup-by-2027-eyed,CK
2025-04-17,Woodside signs two LNG supply deals with Uniper tied to Louisiana LNG project,"Woodside Energy has signed two long‑term sale and purchase agreements with German utility Uniper, totaling 2 mtpa of LNG—covering 1 mtpa from its proposed Louisiana LNG project and up to 1 mtpa from its global portfolio.",https://terminal.kpler.com/insight/news/woodside-signs-two-lng-supply-deals-with-uniper-tied-to-louisiana-lng-project,CK
