Date,Title,Description,URL,Author
2025-02-10,LNG Canada begins new flaring activity as it moves towards first LNG exports,"A new flaring activity has begun at the Shell-led 14 mtpa LNG Canada export project in Kitimat, British Columbia, as it continues its commissioning process and moves closer towards the start of first LNG exports.",https://terminal.kpler.com/insight/news/lng-canada-begins-new-flaring-activity-as-it-moves-towards-first-lng-exports,CK
2025-02-10,Supply woes intensify as EU gas storage volumes slip below 50%,European natural gas prices rose to a two-year high as colder temperatures have accelerated gas demand for heating and accelerated the depletion of the region’s storage facilities to being below 50% full.,https://terminal.kpler.com/insight/news/supply-woes-intensify-as-eu-gas-storage-volumes-slip-below-50,JS
2025-02-10,Deutsche ReGas ends Energos Power FSRU sub-charter,Deutsche ReGas has terminated its sub-charter contract with the German government for the Energos Power floating storage regasification unit (FSRU) at the Deutsche Ostsee LNG terminal in Mukran.,https://terminal.kpler.com/insight/news/deutsche-re-gas-ends-energos-power-fsru-sub-charter,JS
2025-02-10,Greater Tortue Ahmeyim FLNG project achieves first LNG output: Kosmos Energy,"The BP-operated 2.5 mtpa Greater Tortue Ahmeyim floating LNG project on the maritime border of Mauritania and Senegal has produced its first LNG, with the first cargo expected to be exported this quarter, marking both countries' entry into the global LNG market.",https://terminal.kpler.com/insight/news/greater-tortue-ahmeyim-flng-project-achieves-first-lng-output-kosmos-energy,CK
2025-02-10,First LNG ship in months crosses Bab el-Mandeb Strait as ceasefire opens Red Sea routes,"The Salalah LNG tanker has transited the Red Sea and is now heading toward the Suez Canal, becoming the first LNG vessel in months to cross the Bab el-Mandeb Strait following a ceasefire between Israel and Hamas in Gaza.",https://terminal.kpler.com/insight/news/first-lng-ship-in-months-crosses-bab-el-mandab-strait-as-ceasefire-opens-red-sea-routes,CK
2025-02-10,LNG ship diverts from Greece's Alexandroupolis LNG terminal to Turkey as regasification services stay offline,"The 154,800 m3 Gaslog Savannah LNG tanker, originally scheduled to arrive at the Gastrade-operated 4 mtpa Alexandroupolis floating storage regasification unit import terminal in Greece, has diverted to Turkey due to ongoing technical issues that have kept regasification services offline since Jan. 23.",https://terminal.kpler.com/insight/news/lng-ship-diverts-from-greece-s-alexandroupolis-lng-terminal-to-turkey-as-regasification-services-stay-offline,CK
2025-02-10,"Baltic states integrate with European grid, ending Russian electricity ties","Lithuania, Latvia, and Estonia have aligned their electricity systems with the Continental European Synchronous Area, permanently disconnecting from Russia and Belarus.",https://terminal.kpler.com/insight/news/baltic-states-integrate-with-european-grid-ending-russian-electricity-ties,CK
