Date,Title,Description,URL,Author
2025-07-30,"LNG Canada faces technical issues; more delays, diversions possible","The 14 mtpa LNG Canada export plant in Kitimat has been experiencing technical issues with its start-up operations, as the noticed recent delays in loading operations at the facility.",https://terminal.kpler.com/insight/news/lng-canada-faces-technical-issues-more-delays-diversions-possible,JS
2025-07-30,Worley receives full notice to proceed with works on CP2 LNG,"Australian engineering contractor Worley has received a Full Notice to Proceed from Venture Global under its reimbursable engineering, procurement and construction (EPC) contract for the Phase 1 of CP2 LNG export project facility located in Louisiana.",https://terminal.kpler.com/insight/news/worley-receives-full-notice-to-proceed-with-works-on-cp-2-lng,JS
2025-07-30,LNG deliveries to China face delays amid typhoon and tsunami threats to eastern ports,"China’s eastern LNG terminals are bracing for potential disruption as twin natural hazards—Typhoon Co-May and a tsunami triggered by a major earthquake off Kamchatka today—threaten coastal areas, where a few of China’s LNG import terminals are located.",https://terminal.kpler.com/insight/news/lng-deliveries-to-china-face-delays-amid-typhoon-and-tsunami-threats-to-eastern-ports,CK
2025-07-30,"Sakhalin, Japan, Taiwan LNG terminals on tsunami alert after major Kamchatka quake","A powerful magnitude 8.8 earthquake struck off the east coast of Russia’s Kamchatka Peninsula early Wednesday, triggering tsunami warnings for regions along the Pacific coast, including Russia Japan and Taiwan, leading to concerns over LNG supply disruptions with these  countries home to critical LNG export and import terminals.",https://terminal.kpler.com/insight/news/sakhalin-japan-lng-terminals-on-tsunami-alert-after-major-kamchatka-quake,CK
2025-07-30,Knutsen takes delivery of second LNG carrier for QatarEnergy projects,"Norwegian shipping firm Knutsen Group has taken delivery of the 174,000 m3 LNG carrier Mesaieed from South Korea’s HD Hyundai,  the second in a series of ten vessels being built for long-term charter to QatarEnergy.",https://terminal.kpler.com/insight/news/knutsen-takes-delivery-of-second-lng-carrier-for-qatar-energy-projects,CK
