Date,Title,Description,URL,Author
2025-03-17,Croatia completes pipeline to raise Krk LNG’s send-out capacity,"Croatian gas transmission system operator Plinacro has completed the Zlobin-Bosiljevo pipeline, which accommodates Krk LNG terminal’s increase in send-out capacity from 2.4 billion m3/year to 3.5 billion m3/year.",https://terminal.kpler.com/insight/news/croatia-completes-pipeline-to-raise-krk-lng-s-send-out-capacity,JS
2025-03-17,OLT Offshore’s FSRU in Toscana to operate until 2044 following life extension works,"Italy’s 135,000 m3 FSRU Toscana will operate until the end of 2044 due to life extension work carried out on the vessel last year during the seven-month maintenance.",https://terminal.kpler.com/insight/news/olt-offshore-s-fsru-in-toscana-to-operate-until-2044-following-life-extension-works,JS
2025-03-17,Cheniere achieves substantial completion of first train of Corpus Christi Stage 3,"Cheniere said that it achieved “substantial completion” of the first of seven trains of the 10 mtpa Corpus Christi Stage 3 (CCL Stage 3) expansion project, less than a month after the announcement of shipping the project’s first LNG cargo.",https://terminal.kpler.com/insight/news/cheniere-achieves-substantial-completion-of-first-train-of-corpus-christi-stage-3,JS
2025-03-17,Equinor starts up production at new gas field for export to Europe,"Norway’s state-owned Equinor has started up production at the Halten East offshore gas field in the Norwegian Sea, which aims to meet the demand for Norwegian pipeline gas especially in Europe.",https://terminal.kpler.com/insight/news/equinor-starts-up-production-at-new-gas-field-for-export-to-europe,JS
2025-03-17,Greater Tortue Ahmeyim FLNG nears first LNG export as British Sponsor returns to berthing area,"The British Sponsor LNG tanker has returned to the berthing zone of the 2.5 mtpa Greater Tortue Ahmeyim floating LNG project, suggesting it may be preparing for a second loading that could complete the BP-led project’s first full cargo and mark its first LNG export.",https://terminal.kpler.com/insight/news/greater-tortue-ahmeyim-flng-nears-first-lng-export-as-british-sponsor-returns-to-berthing-area,CK
2025-03-17,Woodside signs 15-year LNG supply deal with China Resources Gas,"Australian independent Woodside Energy has agreed to supply China Resources Gas International with 0.6 mtpa of LNG over 15 years, starting in 2027.",https://terminal.kpler.com/insight/news/woodside-signs-15-year-lng-supply-deal-with-china-resources-gas,CK
2025-03-17,"Excelerate, PV Gas agree to collaborate on LNG supply for Vietnam","Excelerate Energy has signed a memorandum of understanding with Vietnam’s state-owned PV Gas to collaborate on securing LNG supply from the US, with deliveries potentially starting as early as 2026.",https://terminal.kpler.com/insight/news/excelerate-pv-gas-agree-to-collaborate-on-lng-supply-for-vietnam,CK
