Date,Title,Description,URL,Author
2023-10-06,Pakistan’s LNG term deal with Azerbaijan’s Socar seen starting in December,"Pakistan’s June deal with Azerbaijan’s state-owned Socar for 12 cargoes to be delivered over
a one-year period is expected to start in December, with the contracted volume and a spot
deal done this week seen lifting the country’s LNG receipts during the last month of this
year.",https://terminal.kpler.com/insight/news/pakistan-s-lng-term-deal-with-azerbaijan-s-socar-seen-starting-in-december,JS
2023-10-06,"Chevron workers to take strike action again at Gorgon, Wheatstone facilities from Oct. 18","The unions representing Chevron’s employees at the onshore Gorgon and Wheatstone facilities and the offshore Wheatstone platform will serve notices of protected industrial action to Chevron on Monday, with strikes at the facilities to begin from Oct. 18 for two weeks.",https://terminal.kpler.com/insight/news/chevron-workers-to-take-strike-action-again-at-gorgon-wheatstone-facilities-from-oct-18,CK
2023-10-06,"Chevron workers may strike again at Wheatstone, Gorgon facilities",Employees at Chevron’s onshore Gorgon and Wheatstone facilities and offshore Wheatstone platform may take strike action at these facilities in response to their unions’ claims that Chevron has omitted key agreed bargaining terms from draft enterprise agreements.,https://terminal.kpler.com/insight/news/chevron-workers-may-strike-again-at-wheatstone-gorgon-facilities,CK
