Date,Title,Description,URL,Author
2023-10-18,Petrobras extends Sequoia FSRU charter with Excelerate Energy by 10 years,"US-based LNG solutions company Excelerate Energy announced on Tuesday that it has signed a charter agreement with Brazil’s state-owned Petrobras for its 5.6 mtpa Sequoia FSRU, which will extend the vessel’s stay in Brazil’s Bahia LNG terminal by 10 years.",https://terminal.kpler.com/insight/news/excelerate-energy-and-petrobras-extend-sequoia-fsru-charted-by-10-years,JS
2023-10-18,Bulgarian tax on transit of Russian pipeline gas unlikely to cut flows to Hungary and Serbia,Bulgaria’s new bill to impose a tax on Russian gas transiting the country will increase the cost of that gas for its customers but may not have the intended outcome of penalising Russia by cutting its revenues through a reduction in the flow and consumption of Russian gas.,https://terminal.kpler.com/insight/news/bulgarian-tax-on-transit-of-russian-pipeline-gas-unlikely-to-cut-flows-to-hungary-and-serbia,JS
2023-10-18,ADNOC Gas signs $500-$700 million multi-year LNG deal with Jera for LNG supplies from UAE,"Abu Dhabi’s state-owned ADNOC Gas agreed to supply LNG from its Das Island project to Jera Global Markets’ global supply portfolio, with the deal valued at AED 1.8 billion to AED 2.5 billion ($500 million to $700 million).",https://terminal.kpler.com/insight/news/adnoc-gas-signs-500-700-million-multi-year-lng-deal-with-jera-for-lng-supplies-from-uae,CK
2023-10-18,"Qatarenergy, Shell agree 27-year deals for up to 3.5 mtpa of LNG supply to the Netherlands",QatarEnergy has agreed two 27-year deals with Shell for the supply of up to 3.5 mtpa of LNG to the 11.8 mtpa Gate LNG terminal in the Netherlands from the planned North Field East and North Field South LNG expansion projects in Qatar.,https://terminal.kpler.com/insight/news/qatarenergy-shell-agree-27-year-deals-for-up-to-3-5-mtpa-of-lng-supply-to-the-netherlands,CK
2023-10-18,"Woodside’s Pluto Train 2 project is 46% complete, target for first LNG cargo in 2026 remains","Woodside’s Scarborough and Pluto Train 2 project was 46% complete at the end of September and the target for production of the first LNG cargo in 2026 is still unchanged, the firm said in its third-quarter 2023 report today.",https://terminal.kpler.com/insight/news/woodside-s-pluto-train-2-project-is-46-complete-target-for-first-lng-cargo-in-2026-remains,CK
2023-10-18,"Strike action at Wheatstone, Gorgon averted; union urges support of draft pay deal","Workers at Chevron’s onshore Wheatstone and Gorgon facilities and the offshore Wheatstone Platform in Western Australia have called off the plan for protected industrial action, averting any disruptions to operations at the facilities ahead of the start of the planned strike action tomorrow.",https://terminal.kpler.com/insight/news/strike-action-at-wheatstone-gorgon-averted-union-urges-support-of-draft-pay-deal,CK
