Date,Title,Description,URL,Author
2025-06-23,"Glenfarne, PTT sign cooperation deal, initial offtake of 2 mtpa of LNG from Alaska LNG",Glenfarne Alaska LNG and Thailand’s PTT have signed a cooperation agreement for strategic participation in the proposed 20 mtpa Alaska LNG project in Nikiski.,https://terminal.kpler.com/insight/news/glenfarne-ptt-sign-cooperation-deal-initial-offtake-of-2-mtpa-of-lng-from-alaska-lng,JS
2025-06-23,LNG Canada produces first LNG,The Shell-led 14 mtpa LNG Canada export project in British Columbia has produced its first LNG and maintains its goal to ship its maiden cargo mid-year.,https://terminal.kpler.com/insight/news/lng-canada-produces-first-lng,JS
2025-06-23,Freeport LNG requests more time to finish Train 4,"Freeport LNG has filed a request with the Federal Energy Regulatory Commission (FERC) to grant a 40-month extension to construct its Train 4 project, citing setbacks from the June 2022 explosion and the long recovery process as the main reasons.",https://terminal.kpler.com/insight/news/freeport-lng-requests-more-time-to-finish-train-4,JS
2025-06-23,"Golar LNG, Kosmos Energy confirm commercial start of Greater Tortue Ahmeyim FLNG","Floating LNG unit player Golar LNG and energy company Kosmos Energy have announced the start of commercial operations of the 2.5 mtpa Greater Tortue Ahmeyim (GTA) FLNG project offshore Senegal and Mauritania, amid the project loading its fourth cargo.",https://terminal.kpler.com/insight/news/golar-lng-kosmos-energy-confirm-commercial-start-of-greater-tortue-ahmeyim-flng,JS
2025-06-23,"Petronas, Jogmec sign cooperation deal to explore bilateral LNG arrangements","PETRONAS LNG and Japan Organisation for Metals and Energy Security (Jogmec) have signed a memorandum of cooperation (MoC) to expand the collaboration framework in the LNG sector, through a strategic arrangement.",https://terminal.kpler.com/insight/news/petronas-jogmec-sign-cooperation-deal-to-explore-bilateral-lng-arrangements,JS
2025-06-23,Woodside signs initial LNG supply deal with Jera for winter season,Woodside Energy Trading Singapore has signed a non-binding heads of agreement (HoA) with Jera for the supply of LNG during Japan’s peak winter period in 2027.,https://terminal.kpler.com/insight/news/woodside-signs-initial-lng-supply-deal-with-jera-for-winter-season,JS
